{
  "schema_version": 2,
  "workstream_id": "human-optical-and-icon-collision-qualification",
  "target": {
    "product": "GLAZE UI V1.3",
    "target_version": "1.3.0-candidate",
    "source_revision": "72ad63bf32d80420b25dc98bfd2def47bcc2a427"
  },
  "status": "passed",
  "observed_at": "2026-09-07T16:06:37Z",
  "review_authority": {
    "mode": "combined",
    "authority": "GoreeCloud human reviewer with GitHub Actions exact-source capture support"
  },
  "environment": {
    "source_tree": "cc1519dd859437969a143a0170996b6ba5e02b76",
    "reference_path": "reference/v1.3/signature-components-and-compositions.html",
    "reference_blob_sha": "c5132902a9dfcc33154c4c45aff0d01b1df2903e",
    "reference_manifest_blob_sha": "5d927f8519ef53b113560e037f86638c42925131",
    "quality_rules_blob_sha": "7ef5ab71ae47e152fd92b736ff116c4d71dd8daa",
    "submitted_reference_sha256": "6b92b4005f58aea24486c08c00a46a600c5ab7911062d862792e9fea0cf33bf2",
    "exact_source_capture_workflow_run": 34135258801,
    "exact_source_capture_artifact_id": 10023716152,
    "exact_source_capture_artifact_digest": "sha256:8a1d48b74869c997b118d4a48773a910d54169d1fbe3c93c44623e6ffd04bb04",
    "capture_count": 12,
    "capture_manifest_verified": true,
    "human_reviewer_attested_exact_source_provenance": true,
    "human_reviewer_attested_all_55_quality_rules_reviewed": true
  },
  "evidence_references": [
    "https://github.com/GoreeCloud/goreecloud-glaze-ui/issues/160#issuecomment-5573213123",
    "https://github.com/GoreeCloud/goreecloud-glaze-ui/actions/runs/34135258801",
    "https://api.github.com/repos/GoreeCloud/goreecloud-glaze-ui/actions/artifacts/10023716152"
  ],
  "quality_review": {
    "contract": "contracts/v1.3/quality-rules.candidate.json",
    "reviewed_rule_ids": [
      "quality-01",
      "quality-02",
      "quality-03",
      "quality-04",
      "quality-05",
      "quality-06",
      "quality-07",
      "quality-08",
      "quality-09",
      "quality-10",
      "quality-11",
      "quality-12",
      "quality-13",
      "quality-14",
      "quality-15",
      "quality-16",
      "quality-17",
      "quality-18",
      "quality-19",
      "quality-20",
      "quality-21",
      "quality-22",
      "quality-23",
      "quality-24",
      "quality-25",
      "quality-26",
      "quality-27",
      "quality-28",
      "quality-29",
      "quality-30",
      "quality-31",
      "quality-32",
      "quality-33",
      "quality-34",
      "quality-35",
      "quality-36",
      "quality-37",
      "quality-38",
      "quality-39",
      "quality-40",
      "quality-41",
      "quality-42",
      "quality-43",
      "quality-44",
      "quality-45",
      "quality-46",
      "quality-47",
      "quality-48",
      "quality-49",
      "quality-50",
      "quality-51",
      "quality-52",
      "quality-53",
      "quality-54",
      "quality-55"
    ],
    "visual_finish_accepted": true,
    "blandness_rejected": true,
    "accessibility_beauty_reviewed": true,
    "responsive_beauty_reviewed": true,
    "critical_final_quality_questions_accepted": true,
    "notes": "Human reviewer explicitly verified the submitted reference surface was rendered from the frozen source revision and accepted the governed Human Optical qualification after reviewing all 55 rules and required final gates. Supporting automation retained exact-source captures but did not supply human judgment."
  },
  "issues": [],
  "disposition": {
    "accepted_for_lifecycle_gate": true,
    "notes": "Accepted for the pre-Candidate Human Optical qualification gate only. This record does not activate Candidate, promote Stable, or establish any other qualification track."
  }
}
