{
  "schema_version": 2,
  "workstream_id": "native-personalization-adapter-qualification",
  "target": {
    "product": "GLAZE UI V1.3",
    "target_version": "1.3.0-candidate",
    "source_revision": "72ad63bf32d80420b25dc98bfd2def47bcc2a427"
  },
  "status": "in_progress",
  "observed_at": "2026-09-07T19:37:07Z",
  "review_authority": {
    "mode": "combined",
    "authority": "GoreeCloud owner / native-personalization reviewer plus repository validation"
  },
  "environment": {
    "draft": true,
    "claimed_native_adapters_status": "must be declared before acceptance",
    "required_claim_validation": [
      "persistence behavior where claimed",
      "system-appearance adapter behavior where claimed",
      "wallpaper-source adapter behavior where claimed",
      "failure and fallback behavior",
      "accessibility overrides remain authoritative over personalization",
      "unsupported adapters explicitly marked not claimed"
    ],
    "privacy_constraints": [
      "no raw wallpaper transmission or telemetry",
      "no Glaze-owned cross-device personalization sync claim"
    ]
  },
  "evidence_references": [
    "contracts/v1.3/qualification-matrix.json#native-personalization-adapter-qualification",
    "evidence/v1.3/templates/qualification-review-worksheets.md#native-personalization-adapter"
  ],
  "issues": [
    {
      "summary": "Claimed native adapters/platforms and real persistence, appearance, wallpaper-source, failure/fallback and accessibility-override behavior have not yet been dispositioned for this exact source revision.",
      "severity": "info",
      "resolved": false,
      "reference": "evidence/v1.3/templates/qualification-review-worksheets.md#native-personalization-adapter"
    }
  ],
  "disposition": {
    "accepted_for_lifecycle_gate": false,
    "notes": "DRAFT ONLY. Resolver behavior and token logic are supporting evidence; acceptance requires real native adapter evidence for every claimed adapter/platform."
  }
}
