{
  "schema_version": 2,
  "workstream_id": "manual-assistive-technology-qualification",
  "target": {
    "product": "GLAZE UI V1.3",
    "target_version": "1.3.0-candidate",
    "source_revision": "72ad63bf32d80420b25dc98bfd2def47bcc2a427"
  },
  "status": "in_progress",
  "observed_at": "2026-09-07T19:37:07Z",
  "review_authority": {
    "mode": "human",
    "authority": "GoreeCloud owner / assistive-technology reviewer"
  },
  "environment": {
    "draft": true,
    "claimed_support_matrix_status": "must be declared before acceptance",
    "required_manual_sessions": [
      "screen reader where claimed",
      "voice control where claimed",
      "switch control where claimed",
      "keyboard navigation and focus order where applicable",
      "large text / zoom / reflow interaction where applicable"
    ],
    "required_observations": [
      "semantics and accessible names",
      "labels and control purpose",
      "state announcements",
      "focus order and focus restoration",
      "issues and dispositions"
    ]
  },
  "evidence_references": [
    "contracts/v1.3/qualification-matrix.json#manual-assistive-technology-qualification",
    "evidence/v1.3/templates/qualification-review-worksheets.md#manual-assistive-technology"
  ],
  "issues": [
    {
      "summary": "Required real assistive-technology sessions and claimed support-matrix declaration have not yet been completed for this exact source revision.",
      "severity": "info",
      "resolved": false,
      "reference": "evidence/v1.3/templates/qualification-review-worksheets.md#manual-assistive-technology"
    }
  ],
  "disposition": {
    "accepted_for_lifecycle_gate": false,
    "notes": "DRAFT ONLY. Automated accessibility checks and visual review do not substitute for the required real assistive-technology sessions."
  }
}
