{
  "schema_version": 2,
  "workstream_id": "human-optical-and-icon-collision-qualification",
  "target": {
    "product": "GLAZE UI V1.3",
    "target_version": "1.3.0-candidate",
    "source_revision": "72ad63bf32d80420b25dc98bfd2def47bcc2a427"
  },
  "status": "passed",
  "observed_at": "2026-09-07T23:30:00Z",
  "review_authority": {
    "mode": "human",
    "authority": "GoreeCloud owner / human reviewer"
  },
  "environment": {
    "browser": "Firefox",
    "reference_origin": "http://127.0.0.1:8080",
    "source_checkout": "detached frozen qualification revision",
    "review_date": "2026-09-07",
    "review_scope": "full 55-rule human optical review including responsive composition, state/overlay quality, accessibility visual fallbacks, motion, icon collision, and scroll polish"
  },
  "evidence_references": [
    "evidence/v1.3/supporting/final-visual-sweep-72ad63bf-2026-09-07.md",
    "evidence/v1.3/supporting/icon-collision-scroll-polish-72ad63bf-2026-09-07.md",
    "evidence/v1.3/supporting/motion-quality-restraint-72ad63bf-2026-09-07.md",
    "evidence/v1.3/supporting/focus-selection-quality-72ad63bf-2026-09-07.md",
    "evidence/v1.3/supporting/accessibility-beauty-visual-fallback-72ad63bf-2026-09-07.md",
    "evidence/v1.3/supporting/large-text-200-percent-72ad63bf-2026-09-07.md",
    "evidence/v1.3/supporting/environment-resolution-72ad63bf-2026-09-07.md",
    "evidence/v1.3/supporting/posture-accessibility-runtime-72ad63bf-2026-09-07.md"
  ],
  "quality_review": {
    "contract": "contracts/v1.3/quality-rules.candidate.json",
    "reviewed_rule_ids": [
      "quality-01",
      "quality-02",
      "quality-03",
      "quality-04",
      "quality-05",
      "quality-06",
      "quality-07",
      "quality-08",
      "quality-09",
      "quality-10",
      "quality-11",
      "quality-12",
      "quality-13",
      "quality-14",
      "quality-15",
      "quality-16",
      "quality-17",
      "quality-18",
      "quality-19",
      "quality-20",
      "quality-21",
      "quality-22",
      "quality-23",
      "quality-24",
      "quality-25",
      "quality-26",
      "quality-27",
      "quality-28",
      "quality-29",
      "quality-30",
      "quality-31",
      "quality-32",
      "quality-33",
      "quality-34",
      "quality-35",
      "quality-36",
      "quality-37",
      "quality-38",
      "quality-39",
      "quality-40",
      "quality-41",
      "quality-42",
      "quality-43",
      "quality-44",
      "quality-45",
      "quality-46",
      "quality-47",
      "quality-48",
      "quality-49",
      "quality-50",
      "quality-51",
      "quality-52",
      "quality-53",
      "quality-54",
      "quality-55"
    ],
    "visual_finish_accepted": true,
    "blandness_rejected": true,
    "accessibility_beauty_reviewed": true,
    "responsive_beauty_reviewed": true,
    "critical_final_quality_questions_accepted": true,
    "notes": "Human reviewer explicitly attested PASS after the consolidated 55-rule and five final-gate statement. Dedicated icon-collision and scroll-polish follow-up also passed. No unresolved material visual defects were reported or identified in the reviewed evidence set."
  },
  "issues": [],
  "disposition": {
    "accepted_for_lifecycle_gate": true,
    "notes": "Accepted for the human-optical-and-icon-collision pre-Candidate workstream only. This does not activate Candidate or Stable; the remaining pre-Candidate workstreams remain independently required for the same frozen source revision."
  }
}
