{
  "schema_version": 2,
  "workstream_id": "native-personalization-adapter-qualification",
  "target": {
    "product": "GLAZE UI V1.3",
    "target_version": "1.3.0-candidate",
    "source_revision": "72ad63bf32d80420b25dc98bfd2def47bcc2a427"
  },
  "status": "in_progress",
  "observed_at": "2026-09-08T00:33:00Z",
  "review_authority": {
    "mode": "combined",
    "authority": "Pending authorized native Personalization adapter reviewer"
  },
  "environment": {
    "draft": true,
    "summary": "DRAFT ONLY — replace with the exact real native Personalization adapter qualification environment before acceptance."
  },
  "evidence_references": [
    "DRAFT: replace with concrete immutable evidence references from the real qualification session"
  ],
  "issues": [
    {
      "summary": "Native Personalization adapter qualification is incomplete. Only adapters actually claimed by the source revision may be reviewed and accepted.",
      "severity": "info",
      "resolved": false,
      "reference": null
    }
  ],
  "disposition": {
    "accepted_for_lifecycle_gate": false,
    "notes": "DRAFT ONLY. No lifecycle promotion, Candidate activation, Stable activation, source cleanup, or consumer conformance is granted by this record."
  }
}
