{
  "schema_version": 2,
  "workstream_id": "manual-assistive-technology-qualification",
  "target": {
    "product": "GLAZE UI V1.3",
    "target_version": "1.3.0-candidate",
    "source_revision": "72ad63bf32d80420b25dc98bfd2def47bcc2a427"
  },
  "status": "passed",
  "observed_at": "2026-09-08T00:49:00Z",
  "review_authority": {
    "mode": "human",
    "authority": "GoreeCloud owner / assistive-technology reviewer"
  },
  "environment": {
    "review_date": "2026-09-07",
    "verification_basis": "owner/human-review attestation",
    "attested_result": "all human verifications passed",
    "scope": [
      "applicable screen-reader verification",
      "applicable voice-control verification",
      "applicable switch-control verification",
      "keyboard navigation and focus order",
      "large text / zoom / reflow interaction",
      "semantics and accessible names",
      "labels and control purpose",
      "state announcements",
      "focus restoration",
      "issue disposition"
    ],
    "support_matrix_status": "all applicable human-verification claims attested passed; no failed or unresolved human finding reported"
  },
  "evidence_references": [
    "evidence/v1.3/supporting/manual-assistive-technology-owner-attestation-72ad63bf-2026-09-07.md",
    "https://github.com/GoreeCloud/goreecloud-glaze-ui/issues/160#issuecomment-5577393655"
  ],
  "issues": [],
  "disposition": {
    "accepted_for_lifecycle_gate": true,
    "notes": "Accepted for the Manual Assistive Technology pre-Candidate workstream at exact frozen source revision 72ad63bf32d80420b25dc98bfd2def47bcc2a427 based on GoreeCloud owner/human-review attestation. This acceptance does not substitute for retained physical/native evidence required by separate combined qualification lanes and does not activate Candidate or Stable lifecycle state."
  }
}
